{"actor":"BUILDER","interruption_reason":"TIMEOUT","operation_id":"op-e1afd67438700196ee0ddcf49541af81c27e8c3520b60a07843c8d9eb491a3c8","phase":"INTERRUPTED","report_path":"C:\\Users\\fael\\AppData\\Local\\Temp\\o0-v2-m5-work\\m5-resume-proof\\builder-timeout\\interrupted\\reports\\builder-report.json","report_sha256":null,"result":null,"schema_version":"0.1","source":{"actor":"BUILDER","audit_round":0,"audit_target_sha":null,"builder_head_sha":null,"last_audited_sha":null,"machine_state":"READY_FOR_BUILD","run_id":"run-4c21fd3e865c4595dc70d9979aa4b28aacdee1d0e723dc5a20674daf59941d95"},"source_state":{"approval":null,"audit_round":0,"audit_target_sha":null,"auditor_executor_id":null,"blocked_reason":null,"builder_branch":"main","builder_executor_id":null,"builder_head_sha":null,"gate":"NONE","human_gate_required":true,"last_audit_report":null,"last_audit_report_sha256":null,"last_audit_result":null,"last_audited_sha":null,"last_builder_report":null,"machine_state":"READY_FOR_BUILD","max_audit_rounds":3,"message":"Ready for Builder.","next_actor":"BUILDER","phase":"O0","product_authority_id":"configured-product-authority","project_id":"interruption-builder-timeout","run_id":"run-4c21fd3e865c4595dc70d9979aa4b28aacdee1d0e723dc5a20674daf59941d95","schema_version":"0.1","updated_at":"2026-09-17T00:57:29.614331+00:00"}}