{"actor":"BUILDER","interruption_reason":"CANCELLED","operation_id":"op-3b30d172aede0f5329213628f94626b21fe2794e3b79a1a3adad140c9a3974d6","phase":"INTERRUPTED","report_path":"C:\\Users\\fael\\AppData\\Local\\Temp\\o0-c45-c9c2137e91e7404b9a038e361b33c441\\reports\\builder-report.json","report_sha256":null,"result":null,"schema_version":"0.1","source":{"actor":"BUILDER","audit_round":0,"audit_target_sha":null,"builder_head_sha":null,"last_audited_sha":null,"machine_state":"READY_FOR_BUILD","run_id":"run-a86e43539817d47c55b28b44b6a8f45bfe58ecfd9f1b7308dc84c0ed8b06da33"},"source_state":{"approval":null,"audit_round":0,"audit_target_sha":null,"auditor_executor_id":null,"blocked_reason":null,"builder_branch":"builder/o0-c45-e2e","builder_executor_id":null,"builder_head_sha":null,"gate":"S1","human_gate_required":true,"last_audit_report":null,"last_audit_report_sha256":null,"last_audit_result":null,"last_audited_sha":null,"last_builder_report":null,"machine_state":"READY_FOR_BUILD","max_audit_rounds":3,"message":"Ready for Builder.","next_actor":"BUILDER","phase":"O0","product_authority_id":"configured-product-authority","project_id":"o0-c45-adversarial-e2e","run_id":"run-a86e43539817d47c55b28b44b6a8f45bfe58ecfd9f1b7308dc84c0ed8b06da33","schema_version":"0.1","updated_at":"2026-09-16T14:16:31.253584+00:00"}}