{"actor":"BUILDER","interruption_reason":"CANCELLED","operation_id":"op-a429837766ee66919c5c13a9ab7cb4e6dac65753a68d7056f52586afb9953ab3","phase":"INTERRUPTED","report_path":"C:\\Users\\fael\\Documents\\Codex\\2026-09-14\\ideias-o0-v2-m2-process-run-final\\interruption_proofs\\builder_cancel\\reports\\builder-report.json","report_sha256":null,"result":null,"schema_version":"0.1","source":{"actor":"BUILDER","audit_round":0,"audit_target_sha":null,"builder_head_sha":null,"last_audited_sha":null,"machine_state":"READY_FOR_BUILD","run_id":"run-42d1274f27321a52a50a77dab1406ce44e76a837b54a761dee45d1a782a2e498"},"source_state":{"approval":null,"audit_round":0,"audit_target_sha":null,"auditor_executor_id":null,"blocked_reason":null,"builder_branch":"main","builder_executor_id":null,"builder_head_sha":null,"gate":"NONE","human_gate_required":true,"last_audit_report":null,"last_audit_report_sha256":null,"last_audit_result":null,"last_audited_sha":null,"last_builder_report":null,"machine_state":"READY_FOR_BUILD","max_audit_rounds":3,"message":"Ready for Builder.","next_actor":"BUILDER","phase":"O0","product_authority_id":"configured-product-authority","project_id":"interruption-builder-cancel","run_id":"run-42d1274f27321a52a50a77dab1406ce44e76a837b54a761dee45d1a782a2e498","schema_version":"0.1","updated_at":"2026-09-16T20:46:54.383306+00:00"}}