{"actor":"AUDITOR","interruption_reason":"CANCELLED","operation_id":"op-fd2d78562abcbd58bc7c747a90e3fb63de7048f1a018b0acd2a88b8bc8978f20","phase":"INTERRUPTED","report_path":"C:\\Users\\fael\\AppData\\Local\\Temp\\o0-v2-m5-work\\m5-resume-proof\\auditor-cancel\\interrupted\\reports\\audit-report.json","report_sha256":null,"result":null,"schema_version":"0.1","source":{"actor":"AUDITOR","audit_round":0,"audit_target_sha":"eb11e1ddcf07b415201cdd49ee81d3b416bd2c6b","builder_head_sha":"eb11e1ddcf07b415201cdd49ee81d3b416bd2c6b","last_audited_sha":null,"machine_state":"READY_FOR_AUDIT","run_id":"run-8dd4e0bc91302e6836ab90267f38b71e258acc9316195bfd2f677785c5e06109"},"source_state":{"approval":null,"audit_round":0,"audit_target_sha":"eb11e1ddcf07b415201cdd49ee81d3b416bd2c6b","auditor_executor_id":null,"blocked_reason":null,"builder_branch":"main","builder_executor_id":null,"builder_head_sha":"eb11e1ddcf07b415201cdd49ee81d3b416bd2c6b","gate":"NONE","human_gate_required":true,"last_audit_report":null,"last_audit_report_sha256":null,"last_audit_result":null,"last_audited_sha":null,"last_builder_report":null,"machine_state":"READY_FOR_AUDIT","max_audit_rounds":3,"message":"Ready for Builder.","next_actor":"AUDITOR","phase":"O0","product_authority_id":"configured-product-authority","project_id":"interruption-auditor-cancel","run_id":"run-8dd4e0bc91302e6836ab90267f38b71e258acc9316195bfd2f677785c5e06109","schema_version":"0.1","updated_at":"2026-09-17T00:58:00.270332+00:00"}}