{"actor":"AUDITOR","interruption_reason":"TIMEOUT","operation_id":"op-e8fc3d32e21f2b7ae05799a5579e4a11716070ab44f9968f4c47918c9c70c737","phase":"INTERRUPTED","report_path":"C:\\Users\\fael\\Documents\\Codex\\2026-09-14\\ideias-o0-v2-m2-process-run-final\\interruption_proofs\\auditor_timeout\\reports\\audit-report.json","report_sha256":null,"result":null,"schema_version":"0.1","source":{"actor":"AUDITOR","audit_round":0,"audit_target_sha":"c3897fde5fe6a6bca5d9a3b811a0d0f4ab79203f","builder_head_sha":"c3897fde5fe6a6bca5d9a3b811a0d0f4ab79203f","last_audited_sha":null,"machine_state":"READY_FOR_AUDIT","run_id":"run-76a188c08fb9138f6da26838d8a83cdd57d6684972158847d81535c92df10f67"},"source_state":{"approval":null,"audit_round":0,"audit_target_sha":"c3897fde5fe6a6bca5d9a3b811a0d0f4ab79203f","auditor_executor_id":null,"blocked_reason":null,"builder_branch":"main","builder_executor_id":null,"builder_head_sha":"c3897fde5fe6a6bca5d9a3b811a0d0f4ab79203f","gate":"NONE","human_gate_required":true,"last_audit_report":null,"last_audit_report_sha256":null,"last_audit_result":null,"last_audited_sha":null,"last_builder_report":null,"machine_state":"READY_FOR_AUDIT","max_audit_rounds":3,"message":"Ready for Builder.","next_actor":"AUDITOR","phase":"O0","product_authority_id":"configured-product-authority","project_id":"interruption-auditor-timeout","run_id":"run-76a188c08fb9138f6da26838d8a83cdd57d6684972158847d81535c92df10f67","schema_version":"0.1","updated_at":"2026-09-16T20:47:01.885135+00:00"}}